### ISSUE TITLE
第1章メモ

### ISSUE THREAD

**Issue by KeihakuOh** [KeihakuOh/go-http-server#5]

**Comment by KeihakuOh** [comment]
<img width="1568" height="435" alt="Image" src="https://github.com/user-attachments/assets/21c6b0dd-3ead-404d-8bae-e7c7279d5bff" />

<html><head></head><body><h1><strong>TCP通信完全理解ノート - パケット解析詳細版</strong></h1>
<h2><strong>画像の通信ログ概要</strong></h2>
<pre><code>通信内容：クライアント（ポート56471）⇔ ローカルWebサーバー（ポート8080）
パケット数：14個（接続確立→データ交換→生存確認）
環境：localhost（127.0.0.1）での開発環境
</code></pre>
<hr>
<h2><strong>Part 1: パケット基本構造とデータの位置</strong></h2>
<h3><strong>パケットの階層構造</strong></h3>
<pre><code>パケット全体の構成：
┌────────────────────────────────┐
│ Ethernetヘッダー               │ 14-20バイト
├────────────────────────────────┤
│ IPヘッダー                     │ 20バイト（固定）
├────────────────────────────────┤
│ TCPヘッダー                    │ 20-60バイト（可変）
├────────────────────────────────┤
│ データペイロード                │ 0-65535バイト
└────────────────────────────────┘
</code></pre>
<h3><strong>重要：データはTCPヘッダーに含まれない</strong></h3>
<pre><code>TCPヘッダー：制御情報のみ（フラグ、ポート番号、シーケンス番号等）
データ部分：TCPヘッダーの「後ろ」に配置される別領域

例：PSH+ACKパケット（81バイト）の構成
├─ Ethernet(20) + IP(20) + TCPヘッダー(32) = 72バイト
└─ データ "GET /"(5) = 5バイト ← TCPヘッダーの外側
                     合計 = 77バイト + パディング = 81バイト
</code></pre>
<hr>
<h2><strong>Part 2: コンピュータによるパケット処理手順</strong></h2>
<h3><strong>TCPヘッダー長の判定プロセス</strong></h3>
<pre><code>Step 1: TCPヘッダーの先頭位置に到達
        IPヘッダーを処理後、TCPセグメント開始位置を特定

Step 2: TCPヘッダーの13バイト目を読み取り
        例：B0を発見

Step 3: 上位4ビットを取り出して計算
        B0 → B(16進数) = 11(10進数) → 11×4 = 44バイト
        「このTCPヘッダーは44バイトある」と判定

Step 4: TCPヘッダー開始位置から44バイト分を処理
        ポート番号、シーケンス番号、フラグ、オプション等を解析

Step 5: 45バイト目以降の処理
        - データがある場合（Len&gt;0）：アプリケーション層へ渡す
        - データがない場合（Len=0）：制御パケットとして処理完了
</code></pre>
<h3><strong>具体例1：SYNパケット（B0 02）の処理</strong></h3>
<pre><code>TCPヘッダー位置: 1  2  3  4  5  6  7  8  9 10 11 12 13 14 ... 44│45以降
実際のデータ:   DC F7 1F 90 00 00 00 00 00 00 00 00 B0 02 ... XX│(なし)
                                                      ↑
                                        ヘッダ長：44バイト指定
                                        データ：なし（Len=0）
</code></pre>
<h3><strong>具体例2：データ送信（80 18）の処理</strong></h3>
<pre><code>TCPヘッダー位置: 1  2  3  4  5  6  7  8  9 10 11 12 13 14 ... 32│33-37
実際のデータ:   DC F7 1F 90 00 00 00 01 00 00 00 01 80 18 ... XX│47 45 54 20 2F
                                                      ↑          │
                                        ヘッダ長：32バイト指定   │"GET /"
                                                                 データ部分
</code></pre>
<hr>
<h2><strong>Part 3: localhost通信の決定的証拠（詳細）</strong></h2>
<h3><strong>証拠1：IPアドレス解析</strong></h3>
<pre><code>IPヘッダー内のアドレスフィールド：
バイト位置 26-29: 7F 00 00 01 = 127.0.0.1（送信元）
バイト位置 30-33: 7F 00 00 01 = 127.0.0.1（宛先）

127.0.0.1の意味：
- ループバックアドレス（RFC 3330定義）
- パケットは物理ネットワークを通らない
- カーネル内部で折り返される
</code></pre>
<h3><strong>証拠2：異常に大きいMSS値</strong></h3>
<pre><code>MSS（Maximum Segment Size）= 16324バイト

通常のMSS値比較：
インターネット（Ethernet）: 1460バイト（MTU 1500 - IP 20 - TCP 20）
PPPoE環境: 1452バイト
ローカルループバック: 16324バイト以上

理由：
- 物理的なMTU制限がない
- フラグメント化の心配がない
- カーネル内部での最適化
</code></pre>
<h3><strong>証拠3：巨大なウィンドウサイズ</strong></h3>
<pre><code>初期Window: 65535バイト
Window Scale: 64（2^6）
実効Window: 65535 × 64 = 4,194,240バイト（約4MB）
行3以降: Win=407744 × 64 = 26,095,616バイト（約25MB）

通常のインターネット通信：
初期Window: 8192-65535バイト
実効Window: 64KB-1MB程度

ローカル通信の特徴：
- パケットロスがない前提
- 遅延がほぼゼロ
- メモリ間の直接転送
</code></pre>
<h3><strong>証拠4：MACアドレスの特殊性</strong></h3>
<pre><code>Ethernetヘッダー内：
宛先MAC: 00:00:00:00:00:00
送信元MAC: 00:00:00:00:00:00

通常のネットワーク：
実MACアドレス例: A4:5E:60:C9:1F:2B

ローカルループバック：
- 実際のネットワークインターフェースを通らない
- 仮想的なパケット処理
- MACアドレスは意味を持たない
</code></pre>
<h3><strong>証拠5：タイムスタンプによる遅延測定</strong></h3>
<pre><code>TSval値の差分計算：
パケット5 TSval: 1872052377
パケット1 TSval: 1872049140
差分: 3237（単位はOSにより異なる、通常は1ms）

推定遅延: 約3.2ミリ秒

比較：
同一LAN内: 1-5ms
インターネット（国内）: 10-50ms
インターネット（海外）: 100-300ms
ローカルループバック: &lt;1ms（理論値）
</code></pre>
<h3><strong>証拠6：開発環境特有のポート番号</strong></h3>
<pre><code>宛先ポート: 8080

ポート番号の意味：
80: HTTP（本番環境）
443: HTTPS（本番環境）
8080: HTTP代替（開発環境）
8000, 3000, 5000: その他の開発用ポート
</code></pre>
<hr>
<h2><strong>Part 4: 3ウェイハンドシェイク詳細（行1-3）</strong></h2>
<h3><strong>行1：SYN - 接続要求</strong></h3>
<pre><code>88 56471 → 8080 [SYN] Seq=0 Win=65535 Len=0 MSS=16324 WS=64 TSval=1872049140 TSecr=0 SACK_PERM

構成：Ethernet(20) + IP(20) + TCP(44) + データ(0) = 84 + パディング = 88バイト

TCPヘッダー詳細（44バイト）：
バイト  値        意味
1-2    DC F7     送信元ポート: 56471
3-4    1F 90     宛先ポート: 8080
5-8    00000000  Seq: 0（初期値）
9-12   00000000  Ack: 0（未使用）
13     B0        Data Offset: 11(×4=44バイト)
14     02        Flags: SYN
15-16  FF FF     Window: 65535
17-18  XX XX     Checksum
19-20  00 00     Urgent Pointer: 0
21-44  [Options] MSS, WS, TS, SACK等のネゴシエーション
</code></pre>
<h3><strong>行2：SYN+ACK - 接続承認</strong></h3>
<pre><code>88 8080 → 56471 [SYN, ACK] Seq=0 Ack=1 Win=65535 Len=0 MSS=16324 WS=64 TSval=875269414 TSecr=1872049140

主な変更点：
- Flags: 0x12（SYN+ACK）
- Ack: 1（クライアントのSeq=0を確認）
- TSecr: クライアントのTSvalをエコーバック
</code></pre>
<h3><strong>行3：ACK - 接続確立完了</strong></h3>
<pre><code>76 56471 → 8080 [ACK] Seq=1 Ack=1 Win=407744 Len=0 TSval=1872049140 TSecr=875269414

構成：Ethernet(20) + IP(20) + TCP(32) + データ(0) = 72 + パディング = 76バイト
注：接続確立後はTCPオプションが削減（44→32バイト）
</code></pre>
<hr>
<h2><strong>Part 5: データ交換フェーズ（行5-8）</strong></h2>
<h3><strong>行5：クライアント→サーバー データ送信</strong></h3>
<pre><code>81 56471 → 8080 [PSH, ACK] Seq=1 Ack=1 Win=407744 Len=5 TSval=1872052377 TSecr=875269414

TCPヘッダー（32バイト）：
13     80        Data Offset: 8(×4=32バイト)
14     18        Flags: PSH+ACK（0x08+0x10）

データ部分（5バイト）：
47 45 54 20 2F = "GET /"（HTTPリクエストの開始）
</code></pre>
<h3><strong>データ位置の明確化</strong></h3>
<pre><code>パケット構造：
[Ethernet][IP][TCPヘッダー32バイト][データ5バイト]
                           ↑        ↑
                    80が示す範囲    Len=5が示す範囲
</code></pre>
<hr>
<h2><strong>Part 6: Keep-Aliveメカニズム（行9-14）</strong></h2>
<h3><strong>Keep-Aliveの動作原理</strong></h3>
<pre><code>通常のSeq番号進行：
最後の送信: Seq=6
次の送信: Seq=6（データなしの場合）

Keep-AliveのSeq番号操作：
送信: Seq=5（意図的に1減らす）
期待する応答: Seq=6, Ack=6（正しい値での応答）

目的：
- TCP接続の生存確認
- NATタイムアウト防止
- ファイアウォールセッション維持
</code></pre>
<hr>
<h2><strong>Part 7: パケットサイズとヘッダー長の関係</strong></h2>
<h3><strong>各パケットタイプの構成詳細</strong></h3>

パケット種類 | 全体 | Ether | IP | TCP基本 | TCPopt | Data | ヘッダ長値
-- | -- | -- | -- | -- | -- | -- | --
SYN | 88 | 20 | 20 | 20 | 28 | 0 | B0(44)
SYN+ACK | 88 | 20 | 20 | 20 | 28 | 0 | B0(44)
ACK | 76 | 20 | 20 | 20 | 16 | 0 | 80(32)
PSH+ACK+Data | 81 | 24 | 20 | 20 | 12 | 5 | 80(32)
Keep-Alive | 64 | 20 | 20 | 20 | 4 | 0 | 60(24)


<h3><strong>ヘッダー長計算の原則</strong></h3>
<pre><code>TCPヘッダー13バイト目の上位4ビット × 4 = TCPヘッダー全体のバイト数
データはこの長さに含まれない（TCPヘッダーの後ろに配置）
</code></pre>
<hr>
<h2><strong>Part 8: フラグフィールドの詳細</strong></h2>
<h3><strong>TCPフラグのビット配置</strong></h3>
<pre><code>ビット位置: 7   6   5   4   3   2   1   0
フラグ名:  CWR ECE URG ACK PSH RST SYN FIN
値(16進):  80  40  20  10  08  04  02  01

主要な組み合わせ：
02 = SYN（接続開始）
10 = ACK（確認応答）
12 = SYN+ACK（02+10）
18 = PSH+ACK（08+10）
11 = FIN+ACK（01+10）
</code></pre>
<hr>
<h2><strong>まとめ：TCP通信の本質</strong></h2>
<h3><strong>パケット処理の要点</strong></h3>
<ol>
<li>TCPヘッダー13バイト目でヘッダー長を判定</li>
<li>ヘッダー長×4でTCPヘッダーの範囲を特定</li>
<li>TCPヘッダー後にデータペイロードが続く</li>
<li>localhost通信は性能パラメータが通常の10-100倍</li>
</ol>
<h3><strong>通信フロー</strong></h3>
<pre><code>接続確立（SYN/SYN+ACK/ACK）
    ↓
データ転送（PSH+ACK）
    ↓
接続維持（Keep-Alive）
    ↓
接続終了（FIN/ACK）※画像には含まれず
</code></pre></body></html>

**Comment by KeihakuOh** [comment]
# **bufioあり/なしの処理の流れを完全追跡**

## **「Hello」を送信する時の全ステップ比較**

### **bufioなし - 直接送信の場合の詳細な流れ**

```go
conn.Write([]byte("Hello"))
```

#### **ステップ1: アプリケーション層**
```
あなたのGoプログラム：
conn.Write([]byte("Hello"))
    ↓
Go言語のnet.Conn.Write()メソッドが呼ばれる
    ↓
内部でsyscall.Write()を呼ぶ準備
```

#### **ステップ2: システムコール発生**
```
Goランタイム：
1. 現在のゴルーチンを一時停止
2. CPUをユーザーモードからカーネルモードに切り替え（重い処理）
3. write()システムコールを実行
    ↓
```

#### **ステップ3: カーネル（OS）の処理**
```
Linuxカーネル内部：
1. ファイルディスクリプタ（接続番号）を確認
2. TCPソケットバッファにデータをコピー
3. TCPプロトコル処理開始
    - TCPヘッダーを作成
    - シーケンス番号を付与
    - チェックサムを計算
4. IPパケットに包む
5. ネットワークドライバに渡す
    ↓
```

#### **ステップ4: ネットワーク送信**
```
ネットワークカード：
1. パケットを電気信号に変換
2. 実際にケーブル/無線で送信
3. 送信完了をカーネルに通知
    ↓
```

#### **ステップ5: システムコール完了**
```
カーネル → Goランタイム：
1. カーネルモードからユーザーモードに戻る（重い処理）
2. ゴルーチンを再開
3. Write()が完了
```

**この全プロセスが毎回発生！**

---

### **bufioあり - バッファ経由の場合の詳細な流れ**

```go
writer := bufio.NewWriter(conn)
writer.Write([]byte("Hello"))
```

#### **ステップ1: バッファへの書き込み**
```
あなたのGoプログラム：
writer.Write([]byte("Hello"))
    ↓
bufio.Writer内部：
1. 内部バッファ（4096バイトの配列）を確認
2. "Hello"（5バイト）をバッファにコピー
3. すぐに制御を返す（システムコールなし！）

内部バッファの状態：
[H][e][l][l][o][空][空][空]...[空] （4096バイト中5バイト使用）
     ↑
   ここまで使用

この時点ではまだ何もネットワークに送られていない！
```

#### **ステップ2: さらにデータを追加**
```go
writer.Write([]byte(" World"))
```
```
bufio.Writer内部：
1. バッファの続きに追加
2. メモリコピーのみ（システムコールなし）

内部バッファの状態：
[H][e][l][l][o][ ][W][o][r][l][d][空]...[空] （11バイト使用）
                                    ↑
                                  ここまで使用
```

#### **ステップ3: Flush()で実際に送信**
```go
writer.Flush()
```
```
bufio.Writer内部：
1. バッファ内の全データ（11バイト）を取り出す
2. conn.Write([]byte("Hello World"))を1回だけ呼ぶ
    ↓
ここで初めてシステムコール発生（1回だけ！）
    ↓
以降は「bufioなし」のステップ2-5と同じ
```

---

## **読み込み時の詳細な流れ**

### **bufioなし - 1バイトずつ読む場合**

```go
buf := make([]byte, 1)
conn.Read(buf)  // "H"を読む
```

#### **毎回の処理**
```
ステップ1: Read()呼び出し
    ↓
ステップ2: read()システムコール（カーネルモード切り替え）
    ↓
ステップ3: カーネルがTCPバッファを確認
    - データがあれば：1バイトコピーして返す
    - データがなければ：ネットワークからの到着を待つ
    ↓
ステップ4: ユーザーモードに戻る
    ↓
ステップ5: 1バイト受け取る

これを文字数分繰り返す！
"Hello"なら5回システムコール
```

### **bufioあり - バッファ経由で読む場合**

```go
reader := bufio.NewReader(conn)
b, _ := reader.ReadByte()  // "H"を読む
```

#### **初回の処理**
```
ステップ1: ReadByte()呼び出し
    ↓
ステップ2: 内部バッファが空なので、大量読み込み
    ↓
ステップ3: conn.Read(4096バイトのバッファ)を呼ぶ
    ↓
ステップ4: read()システムコール（1回だけ！）
    ↓
ステップ5: カーネルから利用可能な分だけ受け取る
    例："Hello World\nNext Line\n"（23バイト）
    ↓
ステップ6: バッファに保存
    内部バッファ：
    [H][e][l][l][o][ ][W][o][r][l][d][\n][N][e][x][t]...
    ↓
ステップ7: 最初の1バイト"H"を返す
```

#### **2回目以降の処理**
```go
b, _ = reader.ReadByte()  // "e"を読む
```
```
ステップ1: ReadByte()呼び出し
    ↓
ステップ2: バッファに残りがあるか確認 → ある！
    ↓
ステップ3: バッファから"e"を取り出して返す
    （システムコールなし！メモリ操作のみ）

内部バッファの状態：
[H][e][l][l][o][ ][W][o][r][l][d][\n][N][e][x][t]...
    ↑
  次はここから読む
```

---

## **具体的なタイミングの違い**

### **チャットアプリでユーザーが入力する場合**

#### **bufioなし**
```go
// ユーザーが1文字ずつタイプ
func handleInput(conn net.Conn) {
    // "H"を入力
    conn.Write([]byte("H"))  // → 即座にネットワークへ（システムコール1）
    
    // "e"を入力  
    conn.Write([]byte("e"))  // → 即座にネットワークへ（システムコール2）
    
    // "l"を入力
    conn.Write([]byte("l"))  // → 即座にネットワークへ（システムコール3）
}

実際の処理タイムライン：
時刻 0ms: "H"入力 → システムコール → パケット送信
時刻 100ms: "e"入力 → システムコール → パケット送信  
時刻 200ms: "l"入力 → システムコール → パケット送信
```

#### **bufioあり**
```go
func handleInput(conn net.Conn) {
    writer := bufio.NewWriter(conn)
    
    // "H"を入力
    writer.Write([]byte("H"))  // → バッファに保存（送信しない）
    
    // "e"を入力
    writer.Write([]byte("e"))  // → バッファに追加（送信しない）
    
    // "l"を入力  
    writer.Write([]byte("l"))  // → バッファに追加（送信しない）
    
    // Enterキーを押した時
    writer.Flush()  // → ここで初めて"Hel"をまとめて送信（システムコール1回）
}

実際の処理タイムライン：
時刻 0ms: "H"入力 → バッファ保存（送信なし）
時刻 100ms: "e"入力 → バッファ追加（送信なし）
時刻 200ms: "l"入力 → バッファ追加（送信なし）
時刻 300ms: Flush() → システムコール1回 → "Hel"をまとめて送信
```

---

## **バッファの中身を可視化**

### **bufio.Writerの内部構造**
```go
type Writer struct {
    err error
    buf []byte  // 4096バイトの配列
    n   int     // 現在使用中のバイト数
    wr  io.Writer  // 実際の接続（net.Conn）
}
```

### **書き込み時の内部状態変化**
```go
writer := bufio.NewWriter(conn)
// 初期状態
// buf: [][][]...[][][] （4096個の空）
// n: 0

writer.Write([]byte("Hello"))
// buf: [H][e][l][l][o][][][]...[][][] 
// n: 5

writer.Write([]byte(" World"))  
// buf: [H][e][l][l][o][ ][W][o][r][l][d][][][]...[][]
// n: 11

writer.Flush()
// conn.Write(buf[0:11]) を実行 ← ここで初めてシステムコール
// buf: [][][]...[][][] （リセット）
// n: 0
```

---

## **なぜFlush()が必要？**

### **Flush()しない場合の問題**
```go
func buggyCode(conn net.Conn) {
    writer := bufio.NewWriter(conn)
    
    writer.Write([]byte("Important message"))
    // Flush()を忘れた！
    
    conn.Close()
    // バッファ内のデータが送信されずに消える！
    // 相手は何も受信できない
}
```

### **自動Flush()される条件**
```go
func autoFlushExample(conn net.Conn) {
    writer := bufio.NewWriter(conn)  // 4096バイトバッファ
    
    // 4100バイトのデータを書く
    bigData := make([]byte, 4100)
    writer.Write(bigData)
    
    // 内部で何が起きるか：
    // 1. 最初の4096バイトでバッファが満杯
    // 2. 自動的にFlush()（システムコール発生）
    // 3. 残り4バイトを新しいバッファに保存
}
```

---

## **パフォーマンスの実体**

### **システムコールのコスト**
```
1回のシステムコールで起きること：

1. CPUの状態を全て保存（レジスタ等）
2. ユーザーモード → カーネルモード切り替え
3. カーネル内で処理
4. カーネルモード → ユーザーモード切り替え  
5. CPUの状態を復元

時間：約0.1-0.5マイクロ秒（環境による）

100文字送信する場合：
- bufioなし：100回 × 0.2μs = 20μs
- bufioあり：1回 × 0.2μs = 0.2μs
→ 100倍の差！
```

---

## **まとめ：本質的な違い**

### **bufioなし**
```
データ → 即座にシステムコール → カーネル → ネットワーク
- 毎回OS呼び出し（重い）
- リアルタイム性高い
- メモリ効率良い
```

### **bufioあり**
```
データ → メモリバッファに蓄積 → Flush()時にシステムコール → カーネル → ネットワーク
- OS呼び出し激減（軽い）
- 遅延あり（Flush()まで送信されない）
- 4KBメモリ使用
```

**つまり：**
bufioは「データを溜めてからまとめて処理する」ことで、OSとのやり取り回数を激減させて高速化を実現しています。

**Comment by KeihakuOh** [comment]
<html><head></head><body><h1><strong>Go TCP接続テストの完全解説 - テストの仕組みと実行フロー</strong></h1>
<h2><strong>1. net.Pipe() - 仮想TCP接続の仕組み</strong></h2>
<h3><strong>net.Pipe()とは何か</strong></h3>
<pre><code class="language-go">server, client := net.Pipe()
</code></pre>
<p><strong>通常のTCP接続：</strong></p>
<pre><code>[クライアント] ←─ ネットワーク ─→ [サーバー]
   PC A                               PC B
</code></pre>
<p><strong>net.Pipe()の仮想接続：</strong></p>
<pre><code>[server側] ←─ メモリ内パイプ ─→ [client側]
同じプロセス内で完結（ネットワーク不要）
</code></pre>
<h3><strong>net.Pipe()の内部実装</strong></h3>
<pre><code class="language-go">// net.Pipeの簡略化された実装
func Pipe() (Conn, Conn) {
    // 双方向のチャネルを作成
    c1 := make(chan []byte, 1)
    c2 := make(chan []byte, 1)
    
    // server側：c1に書き込み、c2から読み込み
    server := &amp;pipeConn{
        writeChannel: c1,
        readChannel:  c2,
    }
    
    // client側：c2に書き込み、c1から読み込み
    client := &amp;pipeConn{
        writeChannel: c2,
        readChannel:  c1,
    }
    
    return server, client
}

// 動作イメージ
client.Write("Hello") → c2チャネル → server.Read() // "Hello"を受信
server.Write("World") → c1チャネル → client.Read() // "World"を受信
</code></pre>
<hr>
<h2><strong>2. TestConnection - 正常系テストの詳細な流れ</strong></h2>
<h3><strong>テスト全体の実行フロー</strong></h3>
<pre><code class="language-go">func TestConnection(t *testing.T) {
    // ステップ1: 仮想接続の作成
    server, client := net.Pipe()
</code></pre>
<p><strong>この時点の状態：</strong></p>
<pre><code>server (net.Conn)          client (net.Conn)
    ↑                          ↑
    └──── メモリ内パイプ ────┘
         （まだ空っぽ）
</code></pre>
<h3><strong>ステップ2: Connectionラッパーの作成</strong></h3>
<pre><code class="language-go">serverConn := NewConnection(server, 5*time.Second, 5*time.Second)
clientConn := NewConnection(client, 5*time.Second, 5*time.Second)
</code></pre>
<p><strong>メモリ上の構造：</strong></p>
<pre><code>serverConn                     clientConn
├─ conn: server               ├─ conn: client
├─ reader: bufio.Reader       ├─ reader: bufio.Reader
│   └─ buf: [4096]byte        │   └─ buf: [4096]byte
├─ writer: bufio.Writer       ├─ writer: bufio.Writer
│   └─ buf: [4096]byte        │   └─ buf: [4096]byte
├─ readTimeout: 5s            ├─ readTimeout: 5s
└─ writeTimeout: 5s           └─ writeTimeout: 5s
</code></pre>
<h3><strong>ステップ3: ゴルーチンでの送信</strong></h3>
<pre><code class="language-go">go func() {
    err := clientConn.Write([]byte("Hello, TCP!\n"))
    if err != nil {
        t.Errorf("Failed to write: %v", err)
    }
}()
</code></pre>
<p><strong>なぜゴルーチンが必要？</strong></p>
<pre><code>同期的に書くと（ゴルーチンなし）：
1. clientConn.Write() → データ送信
2. でも誰も読んでいない！
3. バッファが満杯になる
4. ブロック（永遠に待つ）
5. serverConn.ReadLine()に到達しない → デッドロック！

非同期（ゴルーチンあり）：
1. go func()で別スレッド起動
2. メインスレッド：serverConn.ReadLine()で待機
3. ゴルーチン：clientConn.Write()実行
4. 同時に読み書き可能！
</code></pre>
<h3><strong>ステップ4: データの流れ</strong></h3>
<pre><code class="language-go">// ゴルーチン内
clientConn.Write([]byte("Hello, TCP!\n"))
</code></pre>
<p><strong>詳細な流れ：</strong></p>
<pre><code>1. clientConn.writer.Write([]byte("Hello, TCP!\n"))
   → bufio.Writerのバッファに蓄積

2. clientConn.writer.Flush()
   → client.Write([]byte("Hello, TCP!\n"))
   → net.Pipeの内部チャネルに送信
   
3. メモリ内パイプの状態：
   [H][e][l][l][o][,][ ][T][C][P][!][\n]
   
4. server側で読み取り可能になる
</code></pre>
<h3><strong>ステップ5: サーバー側での受信</strong></h3>
<pre><code class="language-go">received, err := serverConn.ReadLine()
</code></pre>
<p><strong>詳細な流れ：</strong></p>
<pre><code>1. serverConn.reader.ReadString('\n')
   → bufioが内部バッファをチェック（空）
   
2. server.Read(buf[0:4096])を呼ぶ
   → net.Pipeから"Hello, TCP!\n"を取得
   
3. bufioバッファに格納：
   [H][e][l][l][o][,][ ][T][C][P][!][\n][][][]...
   
4. '\n'まで切り出して返す
   → "Hello, TCP!\n"
</code></pre>
<hr>
<h2><strong>3. TestConnectionTimeout - タイムアウトテストの仕組み</strong></h2>
<h3><strong>テストの設定</strong></h3>
<pre><code class="language-go">func TestConnectionTimeout(t *testing.T) {
    server, client := net.Pipe()
    conn := NewConnection(server, 100*time.Millisecond, 100*time.Millisecond)
</code></pre>
<p><strong>100ミリ秒の短いタイムアウト設定の意味：</strong></p>
<pre><code>通常：5秒待つ
テスト：0.1秒だけ待つ（テストを速く終わらせるため）
</code></pre>
<h3><strong>タイムアウト発生の流れ</strong></h3>
<pre><code class="language-go">_, err := conn.ReadLine()
</code></pre>
<p><strong>内部で何が起きているか：</strong></p>
<pre><code>時刻 0ms: ReadLine()開始
    ↓
時刻 0ms: SetReadDeadline(now + 100ms)設定
    現在時刻：14:30:00.000
    期限設定：14:30:00.100
    ↓
時刻 0ms: reader.ReadString('\n')呼び出し
    ↓
時刻 0ms: 内部でserver.Read()実行
    → データなし、待機開始
    ↓
時刻 100ms: カーネルタイマー発火！
    期限（14:30:00.100）到達
    ↓
時刻 100ms: Read()がエラーを返す
    err = &amp;OpError{Op: "read", Net: "pipe", Err: &amp;timeoutError{}}
    ↓
時刻 100ms: "read timeout after 100ms"エラー生成
</code></pre>
<h3><strong>なぜclient側は使わない？</strong></h3>
<pre><code class="language-go">// client側は作成したが使用していない
defer client.Close()  // 閉じるだけ

// 理由：
// - 誰もclientに書き込まない
// - serverは永遠にデータを待つ
// - タイムアウトが発生することを確認
</code></pre>
<hr>
<h2><strong>4. テスト実行の詳細</strong></h2>
<h3><strong><code>go test</code>コマンドの実行</strong></h3>
<pre><code class="language-bash">$ go test -v ./internal/tcp
</code></pre>
<p><strong>実行フロー：</strong></p>
<pre><code>1. Goテストランナー起動
2. Test*で始まる関数を探す
3. 各テスト関数を順番に実行：
   - TestConnection()
   - TestConnectionTimeout()
4. 結果を集計
</code></pre>
<h3><strong>実際の出力例</strong></h3>
<pre><code class="language-bash">$ go test -v ./internal/tcp
=== RUN   TestConnection
--- PASS: TestConnection (0.00s)
=== RUN   TestConnectionTimeout  
--- PASS: TestConnectionTimeout (0.10s)
PASS
ok      internal/tcp    0.102s
</code></pre>
<hr>
<h2><strong>5. テストのアサーション詳細</strong></h2>
<h3><strong>TestConnectionのアサーション</strong></h3>
<pre><code class="language-go">if received != testMessage {
    t.Errorf("Expected %q, got %q", testMessage, received)
}
</code></pre>
<p><strong>%qフォーマットの意味：</strong></p>
<pre><code class="language-go">// %q は文字列を引用符付きで、エスケープ文字も表示
testMessage := "Hello\n"
fmt.Printf("%q", testMessage)  // 出力: "Hello\n"
fmt.Printf("%s", testMessage)  // 出力: Hello
                               //       （改行）

// デバッグに便利：改行やタブが見える
</code></pre>
<h3><strong>TestConnectionTimeoutのアサーション</strong></h3>
<pre><code class="language-go">if err == nil {
    t.Error("Expected timeout error, got nil")
}
</code></pre>
<p><strong>段階的なエラーチェック：</strong></p>
<pre><code>1. エラーが発生したか？
   → err == nil チェック
   
2. タイムアウトエラーか？
   → isTimeout(err) チェック
   
3. 正しいエラーメッセージか？
   → "read timeout after 100ms" 確認
</code></pre>
<hr>
<h2><strong>6. isTimeout関数の詳細動作</strong></h2>
<pre><code class="language-go">func isTimeout(err error) bool {
    // 方法1: net.Errorインターフェース確認
    if netErr, ok := err.(net.Error); ok {
        return netErr.Timeout()
    }
    
    // 方法2: エラーメッセージ確認
    return err != nil &amp;&amp; 
           (err.Error() == "read timeout after 100ms" || 
            err.Error() == "write timeout after 100ms")
}
</code></pre>
<p><strong>型アサーションの詳細：</strong></p>
<pre><code class="language-go">// err.(net.Error) の動作
具体的な例：
err = &amp;net.OpError{
    Op:   "read",
    Net:  "tcp", 
    Err:  &amp;timeoutError{},
}

// 型アサーション
netErr, ok := err.(net.Error)
// ok = true（net.OpErrorはnet.Errorインターフェースを実装）
// netErr.Timeout() = true
</code></pre>
<hr>
<h2><strong>7. deferの実行順序</strong></h2>
<pre><code class="language-go">func TestConnection(t *testing.T) {
    server, client := net.Pipe()
    defer server.Close()  // 2番目に実行
    defer client.Close()  // 1番目に実行
    
    // テスト本体
}
// 関数終了時：
// 1. client.Close()
// 2. server.Close()
// （LIFO: Last In First Out）
</code></pre>
<hr>
<h2><strong>8. テストの並行性問題と解決</strong></h2>
<h3><strong>潜在的な競合状態</strong></h3>
<pre><code class="language-go">// 問題のあるコード（もしgoroutineを使わなかった場合）
func BadTest(t *testing.T) {
    clientConn.Write([]byte("Hello"))  // ブロックする可能性
    received := serverConn.ReadLine()  // 到達しない！
}
</code></pre>
<h3><strong>正しい解決方法</strong></h3>
<pre><code class="language-go">// 方法1: goroutine（現在の実装）
go func() {
    clientConn.Write([]byte("Hello"))
}()
received := serverConn.ReadLine()

// 方法2: チャネルで同期
done := make(chan bool)
go func() {
    clientConn.Write([]byte("Hello"))
    done &lt;- true
}()
received := serverConn.ReadLine()
&lt;-done  // 書き込み完了を待つ
</code></pre>
<hr>
<h2><strong>9. ベンチマークテストの追加例</strong></h2>
<pre><code class="language-go">func BenchmarkConnection(b *testing.B) {
    server, client := net.Pipe()
    defer server.Close()
    defer client.Close()
    
    serverConn := NewConnection(server, 5*time.Second, 5*time.Second)
    clientConn := NewConnection(client, 5*time.Second, 5*time.Second)
    
    message := "Benchmark message\n"
    
    b.ResetTimer()  // 準備時間を除外
    
    for i := 0; i &lt; b.N; i++ {
        go func() {
            clientConn.Write([]byte(message))
        }()
        
        serverConn.ReadLine()
    }
}

// 実行：
// $ go test -bench=.
// BenchmarkConnection-8    100000    10234 ns/op
</code></pre>
<hr>
<h2><strong>まとめ：このテストが検証していること</strong></h2>

テスト | 検証内容 | 成功条件
-- | -- | --
TestConnection | 正常な送受信 | データが正しく届く
TestConnectionTimeout | タイムアウト機能 | 指定時間で諦める


<p><strong>テストの価値：</strong></p>
<ol>
<li><strong>実際のネットワークなしでテスト可能</strong>（net.Pipe）</li>
<li><strong>高速実行</strong>（ミリ秒単位）</li>
<li><strong>再現性が高い</strong>（ネットワーク遅延なし）</li>
<li><strong>並行処理の正しさを検証</strong>（goroutine使用）</li>
</ol></body></html>
